{"schema_version":1,"generated_by":{"product":"FirmwareSight","version":"0.6.0"},"release":{"id":"release-e400a8ac51a57d34e309d254536f8850044ef4dd53e26245045c24fdc86fdcc5","version":"1.2.3","notes":"release-notes.md"},"build":{"snapshot_id":"snap-4b4087e1407ceddcb1e1cfcd978eedbc8906cf88083ba3b4672c7c225ddd8374-p0-normalize-1-a38575cd51ec2730442a0f3b8506c99fc49eec68d4b28ecdc9dda9434709ace6","artifact_sha256":"4b4087e1407ceddcb1e1cfcd978eedbc8906cf88083ba3b4672c7c225ddd8374","git_commit":"585dafd3eb59592563923818cdfec4e9a370a83b","git_tag":"v1.2.3","git_dirty":false},"files":[{"path":"accepted-reviews.json","sha256":"50afd7fab31bbd69f5fb91a5357f3128544e76696b5e3562081acd58e23e0076","size":170},{"path":"analysis.json","sha256":"1e9fde475327c80e0ab85f73893823103079c4c2a652a1c16d31798dfdd5195b","size":26961},{"path":"artifacts/firmware.elf","sha256":"4b4087e1407ceddcb1e1cfcd978eedbc8906cf88083ba3b4672c7c225ddd8374","size":17464},{"path":"artifacts/firmware.map","sha256":"a38575cd51ec2730442a0f3b8506c99fc49eec68d4b28ecdc9dda9434709ace6","size":4664},{"path":"diff.json","sha256":"cf927833217e32fafb7a9f8c703959ba1c6d89191eaccb1a10f0428bd2f9fee0","size":64491},{"path":"gate-results.json","sha256":"278a1a63c5cd81f86319f9393762a17de8ad69d374fa52649ab403738d86ba23","size":4803},{"path":"release-notes.md","sha256":"d547160abce41f59ec545b2013c8f0491f1fe7061834e374e1cdf376ed78f93d","size":151},{"path":"release-report.html","sha256":"2511656870951d47a150dc36b5883d602b0754842996fe5b68c70cf2496d65f1","size":36320},{"path":"SHA256SUMS","sha256":"bba541eeb1c887f8ed023cd47421c0ea68a6f65cb906a2c1d42b2ec293868b67","size":675}],"extensions":{"gate_run_id":"gate-a17e9861ce643da5e7061ac349793f80d1be87736ad52b2daf3433dc8cb8bc26","baseline_snapshot_id":"snap-3f615b6247179d930f59b76dcdbaea1a5eca8c835ab6d410feb20a062f33f21f-p0-normalize-1-832690060a8d25f8acacd85a62ce76bc83dfb6768e435bcc04c51f9664ed363e","policy_sha256":"b87aa057854d8a0089594ad9445b0626174dc0308d636dd6d6854902ae1e5e98","release_version_source":"release.expected_version","analysis_schema_version":1,"diff_schema_version":1,"gate_schema_version":1,"accepted_reviews_schema_version":1,"integrity_model":{"scheme":"sha256-two-layer/1","digest":"SHA-256","sums_file":"SHA256SUMS","manifest_file":"release-manifest.json","self_digest_written":false,"sums_covers":"every bundle file except itself and the manifest","sums_excludes":["SHA256SUMS","release-manifest.json"],"manifest_covers":"every bundle file except itself, SHA256SUMS included","manifest_excludes":["release-manifest.json"],"rule":"no file carries its own digest; SHA256SUMS hashes the payload, release-manifest.json hashes the payload plus SHA256SUMS"}}}
